{
  "schemaVersion": "0.2.0",
  "modelId": "equipment-register-architecture",
  "systemRef": "equipment-register-characterization",
  "strategyRef": "equipment-register-strategy",
  "responsibilityModelRef": "equipment-register-responsibilities",
  "invariantModelRef": "equipment-register-invariants",
  "candidates": [
    {
      "id": "equipment-modular-candidate",
      "name": "Modular equipment operations",
      "status": "selected",
      "rationale": "One local module and datastore satisfy the evidenced short-path forces",
      "elementRefs": ["equipment-operations"],
      "boundaryRefs": ["equipment-boundary"],
      "relationRefs": [],
      "interfaceRefs": [],
      "operationalConsequences": [
        "Equipment changes and audit append share one local transaction boundary"
      ]
    }
  ],
  "singleCandidateJustification": {
    "kind": "short-path",
    "rationale": "The richer S2 alternative adds model and mapping ceremony without evidenced interacting rules",
    "evidenceRefs": ["ev-equipment-maintenance"],
    "strategyAlternativeRefs": ["responsibility-centered-domain"],
    "hardConstraintRefs": []
  },
  "elements": [
    {
      "id": "equipment-operations",
      "name": "Equipment operations",
      "subsystemRef": "equipment-administration",
      "logicalRole": "Own equipment validation, mutation, query, export, and audit coordination",
      "representation": "module",
      "authority": "Controls the equipment transaction boundary",
      "responsibilityRefs": ["maintain-equipment-record"],
      "invariantRefs": ["asset-tag-unique"],
      "decisionRefs": ["choose-equipment-module"]
    }
  ],
  "boundaries": [
    {
      "id": "equipment-boundary",
      "name": "Equipment administration boundary",
      "insideElementRefs": ["equipment-operations"],
      "protectedChange": "Equipment maintenance and audit rules",
      "ownerElementRef": "equipment-operations",
      "decisionRefs": ["choose-equipment-module"]
    }
  ],
  "relations": [],
  "interfaces": [],
  "qualityAssessments": [
    {
      "candidateRef": "equipment-modular-candidate",
      "scenarioRef": "qs-valid-edit",
      "result": "pass",
      "evidence": "A single local transaction owns record and audit mutation",
      "sensitivityPoints": [
        "Rules that require independent audit availability"
      ],
      "tradeoffRefs": ["equipment-module-option"]
    }
  ],
  "constraints": [
    {
      "id": "equipment-owns-writes",
      "decisionRef": "choose-equipment-module",
      "statement": "Only equipment operations may write equipment records",
      "classification": "deterministic",
      "scopeElementRefs": ["equipment-operations"],
      "invariantRefs": ["asset-tag-unique"],
      "observable": {
        "factSource": "source-graph",
        "selector": "equipment-records",
        "predicate": "writers-belong-to-constraint-scope",
        "expected": "true"
      },
      "enforcement": {
        "adapterCapability": "dependency-and-write analysis",
        "timing": "ci",
        "severity": "error",
        "failureMessage": "Equipment record write bypasses its owner"
      },
      "exceptionPolicy": {
        "authority": "architecture owner",
        "expiryRequired": true,
        "requiredRationale": "Name the incident or migration forcing the bypass"
      }
    }
  ]
}
